{
  "$schema": "https://json-schema.org/draft/2020-12/schema",
  "$id": "https://betteruseofai.org/schema/calibration.schema.json",
  "title": "Calibration",
  "description": "Constants the engine needs that are not benchmark rows: tokenizer ratios, cache pricing, hidden context factors, and the output to input energy weight.",
  "type": "object",
  "additionalProperties": false,
  "required": [
    "version",
    "tokenizer",
    "cachedReadShareOfInput",
    "cacheWriteShareOfInput",
    "outputToInputEnergyWeight",
    "hiddenContextFactor",
    "derivedRowWidening"
  ],
  "properties": {
    "version": {
      "type": "string"
    },
    "notes": {
      "type": "string"
    },
    "tokenizer": {
      "type": "object",
      "additionalProperties": false,
      "required": [
        "baseEncoding",
        "providers"
      ],
      "properties": {
        "baseEncoding": {
          "type": "string"
        },
        "providers": {
          "type": "object",
          "additionalProperties": {
            "type": "object",
            "additionalProperties": false,
            "required": [
              "exact",
              "contentClasses"
            ],
            "properties": {
              "exact": {
                "type": "boolean",
                "description": "True when we run the provider's own encoding, so no ratio is applied."
              },
              "contentClasses": {
                "type": "object",
                "additionalProperties": {
                  "$ref": "common.schema.json#/$defs/nonNegativeRange"
                }
              },
              "source": {
                "$ref": "common.schema.json#/$defs/source"
              },
              "notes": {
                "type": "string"
              }
            }
          }
        },
        "charsPerTokenFallback": {
          "type": "object",
          "description": "Characters per token by content class, for the estimate that runs while somebody is still typing and cannot wait for the encoder. Measured against o200k, not guessed: the figure varies from about 5.2 on English prose to about 2.2 on mathematics, so one global number was wrong for every class at once.",
          "additionalProperties": {
            "$ref": "common.schema.json#/$defs/nonNegativeRange"
          }
        },
        "charsPerTokenNotes": {
          "type": "string"
        }
      }
    },
    "cachedReadShareOfInput": {
      "$ref": "common.schema.json#/$defs/nonNegativeRange",
      "description": "No provider publishes the energy cost of a cache hit. The low bound is zero on purpose."
    },
    "cacheWriteShareOfInput": {
      "$ref": "common.schema.json#/$defs/nonNegativeRange"
    },
    "outputToInputEnergyWeight": {
      "$ref": "common.schema.json#/$defs/nonNegativeRange",
      "description": "How much more energy an output token costs than an input token. Used to split a per prompt figure."
    },
    "derivedRowWidening": {
      "$ref": "common.schema.json#/$defs/nonNegativeRange",
      "description": "Multipliers applied to low and high when a per token rate was derived rather than measured."
    },
    "assumedTokenCountWidening": {
      "$ref": "common.schema.json#/$defs/nonNegativeRange",
      "description": "Extra widening when a per prompt row did not publish its token counts."
    },
    "hiddenContextFactor": {
      "type": "object",
      "description": "Web apps hide their system prompts and retrieved context, so counted input is a lower bound. Keyed by surface.",
      "additionalProperties": {
        "$ref": "common.schema.json#/$defs/nonNegativeRange"
      }
    },
    "localPue": {
      "$ref": "common.schema.json#/$defs/nonNegativeRange",
      "description": "Facility overhead for a model running on your own machine. There is no data centre, so this sits at one."
    },
    "parametricWidening": {
      "$ref": "common.schema.json#/$defs/nonNegativeRange",
      "description": "Multipliers for a rate that came out of a formula rather than a measurement. Wider than derivedRowWidening because the formula's unit convention is not fully pinned down; see the dataset changelog."
    }
  }
}
